reply_id,reply_status_id,reply_member_id,reply_date,reply_content
538,2638,9719,1446697097,Who&#39;s leg do I have to jump to get my account here validated? Seriously.....
539,2864,9679,1446697478,Mine.
540,2858,8232,1446698418,"The Adminship will validate your account in short order, but these things aren&#39;t always instant."
542,2528,9719,1446700441,Can you find somebody to activate my account for me?
543,2836,9719,1446700516,Can you find somebody to activate my account for me?
544,2850,9719,1446700612,Can you find somebody to activate my account for me?
545,2620,9719,1446704332,I need my account activated. Can you help out?
546,2745,9719,1446712831,"I am trying to get my account approved by somebody here, can you help me?"
547,700,9149,1446730772,FUCK OFF
548,700,9149,1446730779,FUCK OF FAGGOT
551,649,9719,1446742045,I am trying to get my account activated here. Can you help me out?
552,2671,9719,1446743875,Can you please help me out here? I&#39;ve activated everything in my email and I have even emailed the administratorship here. Am I not doing what is required?
555,2748,9719,1446751403,Can you help me get my account activated? My account has been unactivated the last three days.
556,2862,9719,1446751489,Can you help me get my account activated? It&#39;s been unactivated the last three days now.
557,150,9719,1446752599,My account still hasn&#39;t been activated. Can you help me out?
558,2864,9719,1446770503,"*Laughs* Seriously, can you help me out? Create a thread in the lounge to help my predicament comrade. I really do want to participate in this forum as I have a lot of interesting ideas. "
559,2695,9719,1446770624,"I need my account approved so I can post, can you help me out? Can you find somebody to do so?"
560,2869,9719,1446770700,That&#39;s not very helpful. That&#39;s all you have to retort with?
561,2864,9679,1446770933,You&#39;ll have to wait until Monday. That&#39;s when new accounts are approved.
562,2864,9719,1446771131,"Til Monday? Ah, that sucks but I suppose nothing can be done about it. I&#39;ll wait patiently some more then I guess.<br /><br />"
563,2864,9719,1446771372,I wonder why they are slow to activate new memberships. I apologize for hijacking your message feed with my plight here. I hail from the U.S.S.A behind enemy Jewish lines.
565,627,9719,1446771533,I signed up to the forum three to four days ago. Is it true I have to wait a week until my account is activated?<br /><br />
566,2864,9679,1446771613,It&#39;s just what they do for the sake of efficiency. Every Monday.
567,2864,9719,1446771778,"Alright, thanks for the information. Pleasure to meet your acquaintance as well. "
568,2864,9679,1446771837,Sure thing.
569,2864,9719,1446787946,"So, I decided to register on Revleft forum to debate and criticize Marxism or Communism from a National Socialist perspective. Little did I realize that they have a ban on all fascists where their forum server is located in Germany. *Laughs* I give it less than twenty four hours that they ban me."
570,2864,9679,1446788159,"They also require every post to be looked over by mods before they allow it to be posted. Some of our guys tried to fuck with them, so we know their process."
571,2862,9655,1446839574,Wacha need m8?<br />
573,2886,68,1447722041,me
574,2887,9679,1448074253,*anticipation rises*
575,2900,9679,1450495020,"Yeah, mate&#33; Hope you don&#39;t mind the appropriation."
576,2883,1558,1450731445,https://www.youtube.com/watch?v=5Mfbs_I-fjE
579,2894,353,1453086869,gosto mto quer tc
580,2918,9149,1455726384,No soy indio pero aqui estoy carajo&#33;
581,2922,9503,1455937927,didnt even notice haha sorry 
582,2922,9503,1455937965,your inbox is full too yo 
583,2923,9353,1455971396,Sve piramide u oblake lete.
584,2918,7636,1456176289,I could only imagine 
